{
  "$schema": "https://json-schema.org/draft/2020-12/schema",
  "$id": "https://gridview.local/schemas/season-metadata.schema.json",
  "title": "GridView curated season snapshot metadata",
  "description": "The curated, repository-owned metadata a provider-backed season snapshot carries (runtime activation decision O-14): the curated dataset version, published as `contentVersion`, and the season's display label. Never read from, or inferred from, a provider response. `attributionVersion` is not held here: it is the `version` of the data-source attribution record. `mediaVersion` is not held either: provider-backed snapshots publish no media and carry `null`. One record per season, stored under that season's directory.",
  "type": "object",
  "additionalProperties": false,
  "required": ["kind", "status", "season", "datasetVersion", "seasonLabel"],
  "properties": {
    "kind": { "const": "season-metadata" },
    "status": { "$ref": "common.schema.json#/$defs/mockStatus" },
    "note": { "type": "string" },
    "season": { "$ref": "common.schema.json#/$defs/season" },
    "datasetVersion": {
      "type": "string",
      "description": "Identifies the curated dataset a snapshot was built from. A curator issues a new value whenever the curated identities, names or mappings that feed a provider-backed snapshot change, and never reuses one. Same shape as the existing contentVersion values: the issue date and a same-day counter.",
      "pattern": "^[0-9]{4}[.][0-9]{2}[.][0-9]{2}[.][1-9][0-9]*$"
    },
    "seasonLabel": {
      "type": ["string", "null"],
      "description": "The season's display label (Season.label), or null when none is curated.",
      "minLength": 1,
      "maxLength": 120
    }
  }
}
